{
  "coverage": {
    "confidence_profile": {
      "below_0_65": 0,
      "hedged_but_confident": [],
      "max": null,
      "min": null,
      "n": 0
    },
    "depth": "quick",
    "figures_read": 0,
    "found": 71,
    "has_disease_node": false,
    "id_seq": {
      "gap": 1,
      "link": 2
    },
    "interventions_without_target": [
      "t1",
      "t2"
    ],
    "interventions_without_target_count": 2,
    "limits": {
      "max_papers": 10,
      "max_queries": 2
    },
    "no_quote_discarded": 0,
    "proteins_without_accession": [],
    "proteins_without_accession_count": 0,
    "queries": [
      {
        "n_results": 20,
        "q": "antioxidant supplementation intestinal tumor progression mice",
        "search_id": "s_734cb5b6",
        "tool": "paperclip.search"
      }
    ],
    "quotes_unverified": 0,
    "read": 1,
    "stop_reason": "max_papers",
    "truncated": true,
    "used": 1,
    "years": [
      2010,
      2026
    ]
  },
  "delta": {
    "findings_added": [
      "f1",
      "f2"
    ],
    "gaps_added": [
      "g1"
    ],
    "gaps_resolved": [],
    "links_added": [
      "L1",
      "L2"
    ],
    "links_changed": [],
    "papers_added": [
      "p1"
    ],
    "round": 1,
    "things_added": [
      "t1",
      "t2",
      "t3"
    ]
  },
  "error": null,
  "findings": [
    {
      "flags": [],
      "from": "t1",
      "hedged": false,
      "how": "increases",
      "id": "f1",
      "is_own_result": true,
      "paper": "p1",
      "quote": "Here, we show that supplementation with the antioxidants N-acetylcysteine (NAC) and vitamin E promotes intestinal tumor progression in the ApcMin mouse model for familial adenomatous polyposis, a hereditary form of colorectal cancer, driven by Wnt signaling.",
      "quote_verified": true,
      "round": 1,
      "says": "yes",
      "section": "abstract",
      "to": "t3",
      "where": "apcmin mice"
    },
    {
      "flags": [],
      "from": "t2",
      "hedged": false,
      "how": "increases",
      "id": "f2",
      "is_own_result": true,
      "paper": "p1",
      "quote": "Here, we show that supplementation with the antioxidants N-acetylcysteine (NAC) and vitamin E promotes intestinal tumor progression in the ApcMin mouse model for familial adenomatous polyposis, a hereditary form of colorectal cancer, driven by Wnt signaling.",
      "quote_verified": true,
      "round": 1,
      "says": "yes",
      "section": "abstract",
      "to": "t3",
      "where": "apcmin mice"
    }
  ],
  "gaps": [
    {
      "confidence": 0.286,
      "id": "g1",
      "implied_by": [
        "L1",
        "L2"
      ],
      "missing": [
        "t1",
        "t2"
      ],
      "note": "both connect to t3; no direct link reported",
      "searched_in_round": null
    }
  ],
  "generated_at": "2026-08-16T00:00:00Z",
  "graph_id": "g_min1",
  "interpretability": {
    "assumptions": [
      {
        "basis": "Depth tier requested by the caller; it sets the paper budget for the round. null means the caller did not state one.",
        "id": "assumption.depth",
        "path": "input.depth",
        "synthetic": false,
        "unit": "tier",
        "value": "quick"
      },
      {
        "basis": "Hard ceiling on papers read this round. Every coverage count is bounded by it, so an absent relationship may be a budget artefact.",
        "id": "assumption.limits.max_papers",
        "path": "input.coverage.limits.max_papers",
        "synthetic": false,
        "unit": "papers",
        "value": 10
      },
      {
        "basis": "Hard ceiling on distinct corpus queries issued this round.",
        "id": "assumption.limits.max_queries",
        "path": "input.coverage.limits.max_queries",
        "synthetic": false,
        "unit": "queries",
        "value": 2
      },
      {
        "basis": "Publication window the search was restricted to. null means no window was requested, NOT that the corpus is complete.",
        "id": "assumption.years",
        "path": "input.years",
        "synthetic": false,
        "unit": "year range",
        "value": [
          2010,
          2026
        ]
      },
      {
        "basis": "Fixed weights in score_link. Chosen, not fitted: no labelled corpus exists to fit them against.",
        "id": "assumption.confidence_weights",
        "path": "code.score_link",
        "synthetic": false,
        "unit": "weight",
        "value": {
          "agreement": 0.4,
          "evidence_quality": 0.4,
          "independence": 0.2
        }
      },
      {
        "basis": "Study-design quality prior. An out-of-vocabulary study_type scores as `unknown` (0.4) rather than silently matching something close.",
        "id": "assumption.study_quality_table",
        "path": "code._STUDY_QUALITY",
        "synthetic": false,
        "unit": "score",
        "value": {
          "animal": 0.6,
          "clinical_trial": 0.9,
          "computational": 0.4,
          "human_cohort": 0.8,
          "meta_analysis": 1.0,
          "review": 0.3,
          "test_tube": 0.5,
          "unknown": 0.4
        }
      },
      {
        "basis": "Multiplier applied to a preprint's design score, for absence of peer review.",
        "id": "assumption.preprint_penalty",
        "path": "code.evidence_quality",
        "synthetic": false,
        "unit": "factor",
        "value": 0.8
      },
      {
        "basis": "Only a paper's own results count toward a link's STATE, its agreement term and its independence term -- a review restating forty studies is one paper, and is not independent evidence for any of them. Note the exception: `evidence_quality` averages over every finding on the link, cited background included.",
        "id": "assumption.own_result_only",
        "path": "code._own",
        "synthetic": false,
        "unit": "flag",
        "value": true
      },
      {
        "basis": "Constants in the open-triangle gap ranking, including the 0.6 ceiling that keeps a gap a proposal rather than a finding.",
        "id": "assumption.gap_ranking",
        "path": "code.find_gaps",
        "synthetic": false,
        "unit": "constants",
        "value": {
          "cap": 50,
          "confidence_ceiling": 0.6,
          "degree_cap": 24,
          "route_bonus_coefficient": 0.12,
          "shared_paper_penalty": 0.65
        }
      }
    ],
    "counterfactuals": [
      {
        "change": "One further animal study by a different group reports the opposite direction for L1 (N-acetylcysteine (NAC) --increases--> intestinal tumor progression).",
        "meaning": "The strongest relationship in the graph is not robust to a single contradicting primary result; it is a claim about the literature, not about the biology.",
        "result": "state single_source -> disagreed, heuristic confidence 0.44 -> 0.64"
      },
      {
        "change": "One independent replication of L1 (N-acetylcysteine (NAC) --increases--> intestinal tumor progression) by a different first author.",
        "meaning": "Shows how much of this relationship's score is the independence term rather than the evidence itself.",
        "result": "state single_source -> agreed, heuristic confidence 0.44 -> 0.84"
      },
      {
        "change": "The literature search is re-run without the corpus limits in `coverage.limits`.",
        "meaning": "Absence of a relationship in this graph is evidence about what was read, not about what exists. Only `stop_reason: complete` means the literature was exhausted rather than the budget.",
        "result": "unknown -- 1 of 71 papers found were read this round"
      }
    ],
    "evidence": [
      {
        "claim": "N-acetylcysteine (NAC) increases intestinal tumor progression (apcmin mice)",
        "grade": "MODERATE",
        "id": "evidence.f1",
        "locator": "abstract",
        "quote": "Here, we show that supplementation with the antioxidants N-acetylcysteine (NAC) and vitamin E promotes intestinal tumor progression in the ApcMin mouse model for familial adenomatous polyposis, a hereditary form of colorectal cancer, driven by Wnt signaling.",
        "source_id": "doi:10.3390/antiox10020241",
        "source_type": "publication",
        "source_url": "https://doi.org/10.3390/antiox10020241",
        "synthetic": false
      },
      {
        "claim": "Vitamin E increases intestinal tumor progression (apcmin mice)",
        "grade": "MODERATE",
        "id": "evidence.f2",
        "locator": "abstract",
        "quote": "Here, we show that supplementation with the antioxidants N-acetylcysteine (NAC) and vitamin E promotes intestinal tumor progression in the ApcMin mouse model for familial adenomatous polyposis, a hereditary form of colorectal cancer, driven by Wnt signaling.",
        "source_id": "doi:10.3390/antiox10020241",
        "source_type": "publication",
        "source_url": "https://doi.org/10.3390/antiox10020241",
        "synthetic": false
      }
    ],
    "extensions": {
      "confidence_decomposition": {
        "heuristic": true,
        "is_probability": false,
        "labels": {
          "high": ">= 0.7",
          "low": "< 0.4",
          "medium": ">= 0.4"
        },
        "terms": [
          "agreement",
          "evidence_quality",
          "independence"
        ],
        "weights": {
          "agreement": 0.4,
          "evidence_quality": 0.4,
          "independence": 0.2
        }
      },
      "gaps": [
        {
          "id": "g1",
          "missing_labels": [
            "N-acetylcysteine (NAC)",
            "Vitamin E"
          ]
        }
      ],
      "graph": {
        "graph_id": "g_min1",
        "round": 1,
        "rounds": [
          {
            "ask": "new_question",
            "depth": "quick",
            "n": 1,
            "outcome": "new_evidence",
            "papers_added": 1,
            "target": null
          }
        ],
        "schema_version": "1.1"
      },
      "id_conventions": {